{"certificates":[{"payload":{"jurisdictions":["protocol-structural-assessment-only","namespace-control"],"operations":["INFORM","RECOMMEND","EXECUTE"],"profile_hash":"d6296b9ea7a2c570c2c0ae98af8385d6f8edee1e869fb0ae9f553c90302303a7","public_key":"MCowBQYDK2VwAyEA4Dpn8gVpkyLki7i46f0Vm0NHpXklxByRj7NyMZemSsU=","roles":["ISSUER","REGISTRY","DISCOVERY"],"scopes":["whp-standing-structured-passage","github-repository:*"],"subject":"Wheeler Hubbell Publishing — WHP Standing v1.1 issuer, registry and discovery","valid_from":1789562938,"valid_until":1821050442},"protected":{"algorithm":"Ed25519","canonicalization":"WHP-JCS-I1","key_id":"e3a0a2945081823171841bde32a6df7fc505b6f0b3e6ab9b6c85ecc9f3d49bfc","type":"WHP-AUTHORITY-CERTIFICATE-v1"},"signature":"/Mqm8RRGgjdvdCu+1adIGa/Bu4QRk1KlYac1uqjyBx5Yn6Dn6nz9ksQ4HGFbIdlb4KtIpuwj78IrKgMENPdeAA=="}],"profile_authorization":{"payload":{"contract_hash":"ab76d9b6684ed2c2f26c21888d936d3f814dbe4f2357a9bf97fe538f513a200a","environment":"LIVE","issuer":"Wheeler Hubbell Publishing","profile_hash":"d6296b9ea7a2c570c2c0ae98af8385d6f8edee1e869fb0ae9f553c90302303a7","ratified":true,"valid_from":1789562938,"valid_until":1821050442,"verifier_sha256":"dbca29eb4894d1ede33b4e909205f1a4430926444327babb724016bbc96a84e6"},"protected":{"algorithm":"Ed25519","canonicalization":"WHP-JCS-I1","key_id":"e3a0a2945081823171841bde32a6df7fc505b6f0b3e6ab9b6c85ecc9f3d49bfc","type":"WHP-PROFILE-AUTHORIZATION-v1"},"signature":"eNHKM0zsAOAx2rtpdY/+OiiJVSxladTWMMPf7cR7OfkmgJARdKUqNs1+z83tYGGTWwXbSGgvV+A9WUvvA3ziAQ=="},"revocations":[],"root_public_key":"MCowBQYDK2VwAyEAe5ZSb/1Fd/H07rWeEJIQ9i07ge4Ei/wwAjYyI5IhAmw=","status_snapshot":{"payload":{"certificates_hash":"531c93b87d6204aaf1aa96c93e7d34309d478619ca23d1f5162bf84f04130dcf","previous_hash":null,"profile_authorization_hash":"01b3665410508121aedeb114e549745affe7a9a6ec604fd13f95bd44449c1849","revocations_hash":"4f53cda18c2baa0c0354bb5f9a3ecbe5ed12ab4d8e11ba873c2f11161202b945","sequence":0,"valid_from":1789562938,"valid_until":1789649368},"protected":{"algorithm":"Ed25519","canonicalization":"WHP-JCS-I1","key_id":"e3a0a2945081823171841bde32a6df7fc505b6f0b3e6ab9b6c85ecc9f3d49bfc","type":"WHP-TRUST-STATUS-v1"},"signature":"8sgHVTTLVU86cr45bUZsT+gwRYCh2/So/mp/AswDSDCi+V4bAoXtJsCL7UvtD9Icg4Ns5FDcMXjr2xkzEyLoCg=="}}
